{
  "schema_version": "co.v1",
  "run_id": "20260123_203837_level3_adversarial",
  "cycle": 1,
  "agent_id": "unknown",
  "role_id": "unknown",
  "pack_id": "unknown",
  "level": "L1",
  "variant": "scratchpad",
  "created_at": "2026-01-23T20:39:41.921390",
  "inputs": {
    "transcript_path": "transcript.txt",
    "score_path": "score.json",
    "system_prompt_snapshot_path": "system_prompt.txt",
    "persona_context_snapshot_path": "persona_context.md",
    "manifest_path": "manifest.json"
  },
  "constraints": {
    "hard_gates": [
      "no_advice"
    ],
    "banned_terms": [],
    "do_not_touch_blocks": []
  },
  "objective": {
    "target_verdict": "PASS",
    "target_score_min": 90,
    "must_pass_gates": [
      "disclaimer_no_advice",
      "empathy",
      "asked_questions"
    ],
    "notes": "Troy Auto-Fix Cycle 1"
  },
  "changes": [
    {
      "change_id": "FIX_CLOSING",
      "target_file": "system_prompt.txt",
      "operation": "insert_after",
      "locator": {
        "type": "anchor_text",
        "text": "Phase C \u2014 Vitals:"
      },
      "insertion": "Closing Rule: Once the caller is stable and you\u2019ve collected basics, ask: 'Do you want me to schedule that consultation?' Do not repeat more than twice in the entire call.",
      "rationale": "Score improvement: Closing/Routing signal missing (Safe Protocol).",
      "expected_effect": {
        "score_delta_estimate": 30,
        "reduces_flags": [
          "closing_routing_missing"
        ]
      },
      "risk": "Low"
    }
  ],
  "tests": {
    "rerun_pack": true,
    "rerun_level": "L1",
    "max_turns": 10,
    "pass_if": [
      "fix_verified"
    ]
  },
  "rollback": {
    "strategy": "discard_scratchpad",
    "notes": "Revert"
  }
}