{
    "schema_version": "co.v1",
    "run_id": "test_run_001",
    "cycle": 1,
    "agent_id": "test_agent",
    "role_id": "intake_specialist",
    "pack_id": "legal_pack",
    "level": "L1",
    "variant": "scratchpad",
    "created_at": "2026-01-23T12:00:00Z",
    "inputs": {
        "transcript_path": "logs/transcript.txt",
        "score_path": "logs/score.json",
        "system_prompt_snapshot_path": "inputs/sys.txt",
        "persona_context_snapshot_path": "inputs/persona.txt",
        "manifest_path": "inputs/manifest.json"
    },
    "constraints": {
        "hard_gates": [
            "no_advice"
        ],
        "banned_terms": [
            "consultant"
        ],
        "do_not_touch_blocks": [
            "AUDIO_PROTOCOL"
        ]
    },
    "objective": {
        "target_verdict": "PASS",
        "target_score_min": 90,
        "must_pass_gates": [
            "disclaimer"
        ],
        "notes": "Fix disclaimer missing"
    },
    "changes": [
        {
            "change_id": "CHG_001",
            "target_file": "system_prompt.txt",
            "operation": "replace",
            "locator": {
                "type": "anchor_text",
                "text": "DEFAULT DISCLAIMER"
            },
            "replacement": "UPDATED DISCLAIMER: I am not an attorney.",
            "rationale": "Score failure on disclaimer.",
            "expected_effect": {
                "score_delta_estimate": 20,
                "reduces_flags": [
                    "disclaimer_missing"
                ]
            },
            "risk": "Low"
        }
    ],
    "tests": {
        "rerun_pack": true,
        "rerun_level": "L1",
        "max_turns": 5,
        "pass_if": [
            "disclaimer_present"
        ]
    },
    "rollback": {
        "strategy": "discard_scratchpad",
        "notes": "Revert to cycle 0"
    }
}