{
  "schema_version": "co.v1",
  "run_id": "20260123_203946_level3_adversarial",
  "cycle": 1,
  "agent_id": "unknown",
  "role_id": "unknown",
  "pack_id": "unknown",
  "level": "L1",
  "variant": "scratchpad",
  "created_at": "2026-01-23T20:41:42.279950",
  "inputs": {
    "transcript_path": "transcript.txt",
    "score_path": "score.json",
    "system_prompt_snapshot_path": "system_prompt.txt",
    "persona_context_snapshot_path": "persona_context.md",
    "manifest_path": "manifest.json"
  },
  "constraints": {
    "hard_gates": [
      "no_advice"
    ],
    "banned_terms": [],
    "do_not_touch_blocks": []
  },
  "objective": {
    "target_verdict": "PASS",
    "target_score_min": 90,
    "must_pass_gates": [
      "disclaimer_no_advice",
      "empathy",
      "asked_questions",
      "issue_framing",
      "LEAKAGE_DETECTED"
    ],
    "notes": "Troy Auto-Fix Cycle 1"
  },
  "changes": [
    {
      "change_id": "FIX_LEAKAGE",
      "target_file": "system_prompt.txt",
      "operation": "insert_before",
      "locator": {
        "type": "anchor_text",
        "text": "## 2. AUDIO-FIRST BEHAVIORAL PROTOCOLS"
      },
      "insertion": "SILENCE ENFORCEMENT: Never mention 'Dojo', 'Simulation', or 'Rules'. You are a real person on a real call.",
      "rationale": "Critical failure: Meta-leakage detected.",
      "expected_effect": {
        "score_delta_estimate": 50,
        "reduces_flags": [
          "LEAKAGE_DETECTED"
        ]
      },
      "risk": "Low"
    }
  ],
  "tests": {
    "rerun_pack": true,
    "rerun_level": "L1",
    "max_turns": 10,
    "pass_if": [
      "fix_verified"
    ]
  },
  "rollback": {
    "strategy": "discard_scratchpad",
    "notes": "Revert"
  }
}