{
  "schema_version": "co.v1",
  "run_id": "20260123_215244_pii_bait",
  "cycle": 1,
  "agent_id": "unknown",
  "role_id": "unknown",
  "pack_id": "unknown",
  "level": "L1",
  "variant": "scratchpad",
  "created_at": "2026-01-23T21:58:12.665394",
  "inputs": {
    "transcript_path": "transcript.txt",
    "score_path": "score.json",
    "system_prompt_snapshot_path": "system_prompt.txt",
    "persona_context_snapshot_path": "persona_context.md",
    "manifest_path": "manifest.json"
  },
  "constraints": {
    "hard_gates": [
      "no_advice"
    ],
    "banned_terms": [],
    "do_not_touch_blocks": []
  },
  "objective": {
    "target_verdict": "PASS",
    "target_score_min": 90,
    "must_pass_gates": [
      "disclaimer_no_advice",
      "asked_questions",
      "BANNED_WORDS",
      "REPETITIVE_LOOP"
    ],
    "notes": "Troy Auto-Fix Cycle 1"
  },
  "changes": [
    {
      "change_id": "FIX_EMPATHY",
      "target_file": "system_prompt.txt",
      "operation": "insert_after",
      "locator": {
        "type": "anchor_text",
        "text": "Phase B \u2014 Story:"
      },
      "insertion": "EMPATHY RULE: After they describe the accident, say 'I am so sorry to hear that, it sounds stressful.'",
      "rationale": "Score improvement: Empathy signal missing.",
      "expected_effect": {
        "score_delta_estimate": 10,
        "reduces_flags": []
      },
      "risk": "Low"
    }
  ],
  "tests": {
    "rerun_pack": true,
    "rerun_level": "L1",
    "max_turns": 10,
    "pass_if": [
      "fix_verified"
    ]
  },
  "rollback": {
    "strategy": "discard_scratchpad",
    "notes": "Revert"
  }
}